,title,category,description,tags,other_info,link,time_added
63,Zenbership,crms,"Zenbership is open source software that provides membership-based small businesses & organizations with the tools they need to acquire, convert, and retain members. The program is designed to combine multiple tools into a single platform, freeing up businesses to focus on efficiently marketing their services rather than trying to manage them.",CRM,,https://startupresources.io/resource/zenbership/,2022-02-05 16:55:12
64,Teamleader,crms,"Teamleader enables small and medium-sized businesses to stay organized, build better relationships and collaborate with their team in a single tool. A simple and straightforward interface with a variety of integrations allows growing enterprises to successfully manage their clients, be more efficient, and work smarter.",CRM,,https://startupresources.io/resource/teamleader/,2022-02-05 16:55:17
65,SalesforceIQ,crms,"Formerly called RelateIQ, a friend of mine raved about this system because it allowed him to know what every remote team member was getting done, so that he didn’t have to check in with them and continually ask what they were getting accomplished. SalesforceIQ’s focus is improving your sales team with better intelligence on the relationship that your company has with its customers. Anyone into sales knows that a connection and relationship is what closes the deal, so that’s what SalesforceIQ is for.",CRM,,https://startupresources.io/resource/salesforceiq/,2022-02-05 16:55:21
66,close.io,crms,"Close.io is a CRM focused on sales, designed originally as an in-house tool for Steli Efti and his crew at Elastic Sales. Sick of doubling your work by contacting people via email or on the phone, then going back and logging it in the system later? Close.io, among other things, reduces that workload by tracking communications via close.io. Spend more time pursuing and closing your leads and less time doing data entry.","CRM, Sales",,https://startupresources.io/resource/close-io/,2022-02-05 16:55:25
67,Agile CRM,crms,"A flexible and full-featured CRM, Agile can do just about anything and plug into a ton of different APIs to keep track of leads and progress with sales. Connect it to everything from social media to SMS systems to your billing, or even Zapier.",CRM,,https://startupresources.io/resource/agile-crm/,2022-02-05 16:55:29
68,Asana,crms,"Asana is project management for teams, and is flexible enough that some people use it for a CRM, or to track their individual projects and to-do lists. Keep track of ideas, assign certain tasks to team members, and monitor progress of projects easily with Asana.","CRM, Organization",,https://startupresources.io/resource/asana/,2022-02-05 16:55:33
69,Validately,customerdiscovery,"Broader in scope than these other tools, Validately allows you to run tests, but also listen to and watch users try to make their way through your website. This may be the best solution if you wanted to perform user research more like focus groups.",CustomerDiscovery,,https://startupresources.io/resource/validately/,2022-02-05 16:55:41
70,Survicate,customerdiscovery,"Survicate engages the users on your site right now with surveys. It’s like a survey disguised as a chat box, ready to take feedback casually from your site traffic. Ask about your competition, if people completed their goals on your site, refine your product offering, and more.",CustomerDiscovery,,https://startupresources.io/resource/survicate/,2022-02-05 16:55:45
71,Proved,customerdiscovery,"Targeted specifically at Startups, proved.co provides the tools and audiences to test your business idea and try to validate it before pursuing it and building it out. Plans range from free (talk to five respondents to try it out) to enterprise with SWOT analysis.",CustomerDiscovery,,https://startupresources.io/resource/proved/,2022-02-05 16:55:50
72,aytm,customerdiscovery,"AYTM provides survey tools and the audience to take your surveys. Choose the demographics and locations you want. It’s pretty affordable, at less than a dollar a survey. Make sure your questions are open-ended, to get the most out of the surveys as far as Customer Discovery methods go.",CustomerDiscovery,,https://startupresources.io/resource/aytm/,2022-02-05 16:55:54
73,Youteam,development,"Youteam is quite interesting as it’s a hybrid approach. You speak directly with the talented individuals, but they are actually employed by agencies, who you contract with only after selecting a developer. Looks like a somewhat separate talent pool from other marketplaces, so quite interesting.",Development,,https://startupresources.io/resource/youteam/,2022-02-05 16:55:59
74,FakeJSON,development,Clever API to create realistic test data for mocking JSON-based APIs or JavaScript UIs.,Development,,https://startupresources.io/resource/fakejson/,2022-02-05 16:56:03
75,Toptal,development,Do you already have a development team but they’re swamped and you need to add someone on temporarily? Need to bring someone on to handle implementing a certain something that you can’t figure out yourself? Want to hire someone to add the backend to the frontend that you already coded? Or need someone to do all of the development? Toptal can handle all that and more. Hire coders from the best of the best. This is the only development company that never let me down.,"Development, Hiring",,https://startupresources.io/resource/toptal/,2022-02-05 16:56:07
76,Tesults,development,"Tesults makes automating tests for your systems easy, and the results empower your team to improve quality of your service and reduce costs of your operation.",Development,,https://startupresources.io/resource/tesults/,2022-02-05 16:56:12
77,Snapshooter,development,"If you host with Digital Ocean, schedule frequent snapshots of your droplets to backup hourly or daily. Digital Ocean is awesome but their automated backups are limited.",Development,,https://startupresources.io/resource/snapshooter/,2022-02-05 16:56:16
78,OneNine,development,"If you don’t need a complicated site, one with a convoluted back end and databases and everything, but you still want a beautiful responsive site, OneNine does great work. They also do branding, so they can take your project visually from start to finish. Plus they do social media consulting, training and management. Booyah.",Development,,https://startupresources.io/resource/onenine/,2022-02-05 16:56:20
79,Gigster,development,"Gigster wants to make it easy to hire an elite development team very quickly. They promise a quote within 10 minutes of initially submitting the project, and weekly check-ins as they develop your product. Which is nice, because if you’ve ever hired a developer who ends up not keeping you up to date, you know how frustrating that can be.",Development,,https://startupresources.io/resource/gigster/,2022-02-05 16:56:24
80,Acklen Avenue,development,"Focusing on custom software development, Acklen Avenue is an agile team of coders who can build your backend, software suite, or full website. They focus on writing clean code that is easy to manage and to later upgrade if necessary. Acklen Avenue is who I plan to hire for my next big project.",Development,,https://startupresources.io/resource/acklen-avenue/,2022-02-05 16:56:28
81,Squadhelp.com,domains,"These folks are disrupting the traditional agency model by allowing companies to engage with hundreds of naming experts. Their platform combines crowdsourcing, AI and gamification to help companies come up with high quality name ideas instantly. In addition to comprehensive Trademark validation, they offer audience testing to ensure that names resonate with your target audience. There is also a curated collection of premium domains to purchase instantly. They have over18,000 customers and 75,000 creatives and were recently recognized by Inc Magazine as one of the six most innovative companies in the 2018 Inc 500 List.",Domains,,https://startupresources.io/resource/squadhelp-com/,2022-02-05 16:56:32
82,startup name check,domains,"Lets you check for name availability across multiple TLDs and social media, and also generates suggestions. Once you find a good name, click through to register it at Namecheap. Very cool tool while you’re researching names.",Domains,,https://startupresources.io/resource/startup-name-check/,2022-02-05 16:56:37
83,NameQL,domains,"NameQL is a very fast domain name generator that focuses on suggestions for available .com domains. It starts with suggestions for common pre- or postfixes which makes it quite useful, and it is very easy and free to use.",Domains,,https://startupresources.io/resource/nameql/,2022-02-05 16:56:41
84,Panabee,domains,"Can’t think of a good name for your Startup? Frustrated because every decent dot com is taken already, squatted by some guy that wants $15k for it? Take a word or two and input into Panabee and it will show you all the combinations and possible plays on spelling so that you can find a domain that is still available.",Domains,,https://startupresources.io/resource/panabee/,2022-02-05 16:56:45
85,NameCheap,domains,"There are so many places that you could buy a domain name, but NameCheap comes highly recommended by a ton of Startup professionals because of the quality of the system, the pricing, and the easy of setup. It’s where I buy all my domains now. And if you want one of these sexy .io domains, you don’t have to pay $80 anymore, as NameCheap offers them for less than half of that. Don’t buy domains anywhere else.",Domains,,https://startupresources.io/resource/namecheap/,2022-02-05 16:56:49
86,NameMesh,domains,Have an idea of a name for your Startup but can’t quite nail it down? Have no idea at all what to name it? Take two words or ideas and put them into NameMesh and it will show you all the possible domain names based on the amalgamations of those two words.,Domains,,https://startupresources.io/resource/namemesh/,2022-02-05 16:56:52
87,EuroDNS,domains,"If you need to register domains that aren’t easily available in the US, try EuroDNS, which will give you access to all sorts of TLDs you can’t purchase with the usual registrars. Need a .bo domain for your cool new site startupho.bo? They have all the unusual domain endings that will let you get the domain you really want.",Domains,,https://startupresources.io/resource/eurodns/,2022-02-05 16:56:57
88,Brandpa,domains,"Brandpa helps entrepreneurs and business owners find a perfect brand name for their startup / product. The names, include a domain name and logo. We built this website because we value other people’s time. Now, instead of spending months on searching / creating a new name, you can visit Brandpa and purchase a domain name of your liking in minutes.",Domains,,https://startupresources.io/resource/brandpa/,2022-02-05 16:57:01
89,Klenty,emailtools,"Klenty is similar to Mailshake but some added features. Not only does it let you send the kind of automated email sequences with reply detection that Mailshake does, but it also helps with your prospecting, and lets you build cadences that include todo items, not just emails (e.g., you might want to make a phone call after sending the first couple of emails).",EmailTools,,https://startupresources.io/resource/klenty/,2022-02-05 16:57:05
90,Snovio,emailtools,Snovio is a tool for finding email addresses and for automating outbound campaigns.,EmailTools,,https://startupresources.io/resource/snovio/,2022-02-05 16:57:10
91,Woodpecker,emailtools,It’s a sales automation tool that allows you to automate your cold emails and follow-up messages.,EmailTools,,https://startupresources.io/resource/woodpecker/,2022-02-05 16:57:14
92,Constant Contact,emailtools,"Amazing customer support, list building tools, and email tracking reports.",EmailTools,,https://startupresources.io/resource/constant-contact/,2022-02-05 16:57:18
93,Mailshake,emailtools,"Mailshake lets you create automated email sequences with reply detection, that get sent right from your own Gmail or G Suite mailbox, which helps guarantee email delivery. It does one thing and does it quite well, and at a nice price point.",EmailTools,,https://startupresources.io/resource/mailshake/,2022-02-05 16:57:22
94,Reply,emailtools,"Reply strikes the right balance in terms of feature completeness, advanced functionality, and price. It’s got everything you might need, both for mass campaigns and for adding individual contacts to a campaign right from your inbox, advanced reply detection and various other safety mechanisms.",EmailTools,,https://startupresources.io/resource/reply/,2022-02-05 16:57:26
95,Zoho Mail,emailtools,"Do you ever create sites and need an email address for it but it’s not something you plan on using often or a project you’re not going to pursue yet? Back in the good old days, you could slap Gmail on that domain for free, but now it’s $5 per user per month and that adds up. Zoho has a free mail plan which is super nice. It’s what I use for StartupResources.io. It’s free up to ten users for the basic plan, and their paid plans are affordable if you need to scale up. It has a nice iPhone app as well.",EmailTools,,https://startupresources.io/resource/zoho-mail/,2022-02-05 16:57:30
96,UnRoll Me,emailtools,"Ever wanted to unsubscribe from all the email lists you’re on? UnRoll.me does two things very well: audits your inbox and allows you to unsubscribe from things super easily en masse, and also lets you choose to put certain emails like newsletters into a ‘daily roll up’ so that your inbox is way less cluttered. Clean out the crap and then organize the rest.",EmailTools,,https://startupresources.io/resource/unroll-me/,2022-02-05 16:57:34
97,Sanebox,emailtools,"I’ve used Sanebox for a couple years, and it’s pretty great. The idea is that it pre-sorts your email for you, putting less important stuff in a ‘Later’ folder, and newsletter emails and the like in a ‘News’ folder. This filters out the less important emails so that your inbox stays more manageable. Those other emails are still easy to get to, they just don’t distract you constantly anymore. Using Sanebox plus having my iPhone only check email every 15 minutes really reduced email distraction on the go. I only see stuff worth seeing. And it’s easy to train the system, in case it puts important stuff in the Later folder, or if it’s allowing non-important stuff to make its way to the inbox. Get $15 off a subscription through this special link.",EmailTools,,https://startupresources.io/resource/sanebox/,2022-02-05 16:57:38
98,Quickmail,emailtools,"If you need to send a lot of individual emails to prospects or clients, sending them one by one from Gmail can get pretty tedious. Quickmail is an awesome service that piggybacks onto Gmail and automates sending out these emails. You can put all the details and personalizations in a Google Sheet, and it will know what first name and company to mention in the email and so forth. It’s easy to use and keeps track of bounce rates and open rates and other stats, as well as performing automatic followups and drips.",EmailTools,,https://startupresources.io/resource/quickmail/,2022-02-05 16:57:42
99,Mailtrack,emailtools,"This Gmail plugin lets you know when someone reads your email, which is creepy and really handy. You’ll know that someone read your email when they don’t take time to reply, so at least you know they saw your message.",EmailTools,,https://startupresources.io/resource/mailtrack/,2022-02-05 16:57:46
100,Mixmax,emailtools,"Mixmax is a plug in for Gmail and Inbox with a crazy amount of features, including but not limited to: Bulk email sending, mail merge, email templates, sending at a later time, mail tracking. They’re even building in drip email sequences. It replaces my need for a lot of email tools I was previously using, because it does so much by itself. Awesome.",EmailTools,,https://startupresources.io/resource/mixmax/,2022-02-05 16:57:49
101,Builtwith,espionage,"Free tool that shows what technologies a site is, well… Built With.",Espionage,,https://startupresources.io/resource/builtwith/,2022-02-05 16:57:54
102,Wappalyzer,espionage,"If you want to know what other people are building their sites on, Wappalyzer is a browser plugin that will show you that information when you visit the site. They also have huge lists available of sites that are run on certain frameworks, which could be very valuable if you are trying to market a service to sites that are built on Bootstrap for example.",Espionage,,https://startupresources.io/resource/wappalyzer/,2022-02-05 16:57:58
103,SimilarWeb,espionage,"If your competitors have a large amount of traffic, SimilarWeb can return a ton of information on them, like how they get traffic, who else is similar to them online, their biggest direct sources of traffic and so on. Pretty powerful way to look at your competition’s online presence and traffic network… and then go after it.",Espionage,,https://startupresources.io/resource/similarweb/,2022-02-05 16:58:02
104,Rapportive,espionage,"My favorite plugin for Gmail, Rapportive automatically pulls up the LinkedIn and Twitter profiles of the person sending me the email. That makes it obviously super easy to both follow them on Twitter if I’m so inclined, or request them on LinkedIn. And if I request them on LinkedIn via Rapportive, I don’t have to specify if they are a friend or coworker or anything, which makes the request that much easier.",Espionage,,https://startupresources.io/resource/rapportive/,2022-02-05 16:58:07
105,Discoverly,espionage,"Discoverly is similar to Rapportive in that it shows social networking information on someone at a glance. But it goes way further and shows you Facebook information for someone when you’re on LinkedIn, Facebook and LinkedIn information when you’re looking at someone on AngelList, etc. If you want to get the gist of someone’s social media presence at a glance from their profile on any site, grab this Chrome browser extension.",Espionage,,https://startupresources.io/resource/discoverly/,2022-02-05 16:58:10
106,Backlink Spy,espionage,"In the world of SEO, backlinks are still very important for your rankings. And when you’re trying to outrank your competition for a certain phrase, it helps to know what backlinks they have, so that you can try to duplicate or improve on their link and SEO strategy. Backlink Spy helps you do that easily.",Espionage,,https://startupresources.io/resource/backlink-spy/,2022-02-05 16:58:14
107,FileZilla,filetransfer,"FTP clients are nothing new at all, but they’re still crucial for a ton of web work. FileZilla is just a nicely designed FTP client, available on a ton of different platforms. It’s the application that I will use to upload this HTML file after I finish this wonderful description. I use it constantly.",FileTransfer,,https://startupresources.io/resource/filezilla/,2022-02-05 16:58:18
108,Startup Models,financial,"A bit stale, having not been updated in a couple years, someone recommended adding this as a resource, as Startup Models has free financial model Excels for Startups, as well as an affordable e-book on getting your numbers proper to launch or manage a Startup. (If anyone knows a better resource for this sort of thing, please tell me.)",Financial,,https://startupresources.io/resource/startup-models/,2022-02-05 16:58:23
109,Poindexter,financial,"Poindexter is the easiest way to create financial forecasts and budgets for new business plans. See what your future financial projections look like based on your current growth rates. Track marketing expenses and estimated ROI. Build Businesses, Not Spreadsheets.",Financial,,https://startupresources.io/resource/poindexter/,2022-02-05 16:58:26
110,Mint,financial,"Mint’s been around for a while, as a personal financial monitoring tool. It syncs with your bank accounts and credit cards and will watch your spending, allowing you to track what you’re spending money on and making sure you don’t go over in all your budgets. And while it’s for personal use, it can also easily be set up to monitor your Startup’s accounts, too. It makes monthly budgeting and tax time a lot easier for me.",Financial,,https://startupresources.io/resource/mint/,2022-02-05 16:58:30
111,Jack,financial,"Jack is business insurance for developers and designers. Their policy helps with unpaid invoices, disgruntled clients, breach of contract and more. (Currently UK only.)",Financial,,https://startupresources.io/resource/jack/,2022-02-05 16:58:33
112,Financials OnTap,financial,"Financials OnTap is a service that matches freelance top finance & accounting talent with startups. We offer a flexible cost-efficient way to plan, budget, and report on your business. We are project based and on-demand model which means you pay only for what you need and we operate on your timeline. We do budgets, projections, planning, presentation development, investor reporting, metric tracking and dashboarding, cap tables and give all around solid advice, such as: ‘this stuff shouldn’t be expensive!’ Rates start at $50/hr. Get pro forma’s built for as little as $300.",Financial,,https://startupresources.io/resource/financials-ontap/,2022-02-05 16:58:37
113,Float,financial,"It’s pretty impossible to know exactly how your business will be doing in the future, but the raison d’être for Float is to help you forecast your future cashflow by syncing with your invoicing systems and budgets. Keep an eye on your burn rate and runway so that you do not run out of capital and have to go from a Startup to a Shutdown.",Financial,,https://startupresources.io/resource/float/,2022-02-05 16:58:42
114,CountUp.io,financial,"CountUp is a free platform for entrepreneurs to find and work with on demand accountants, and they do all the legwork of searching, inquiring and delegating tasks for you, saving you time and money. No more bloated accounting firm hourly rates, physical visits to “brick & mortar” locations, and wasted time searching on your own. Just tell us your situation and they will match you with the right accountant who will get accounting done. Safely collaborate online, exchange files, e-sign legal documents and pay only for work you approve. CountUp has curated a network of hand-picked independent accountants who specialize in startups and entrepreneurs. These experts were screened to have a valid CPA license and considerable work experience with startups. CountUp is like having access to a firm with an endless supply of on-demand accounting services, minus the massive overhead that would cost you an arm and a leg.",Financial,,https://startupresources.io/resource/countup-io/,2022-02-05 16:58:46
115,AccountEdge,financial,"AccountEdge Pro allows business owners to organize, process, and report on their financial information with ease so they can focus on their business. Its feature set is built to allow users to handle every aspect of their business including accounting, integrated payroll, sales and purchases, contact management, inventory, online orders, and time billing.",Financial,,https://startupresources.io/resource/accountedge/,2022-02-05 16:58:50
116,Angeloop,financial,Track and share your financial data with Angeloop. Why? So that your investors and potential investors can know how your Startup is really performing. Customize and manage your Key Performance Indicators. Angeloop will make it easy too by automatically importing your financials.,Financial,,https://startupresources.io/resource/angeloop/,2022-02-05 16:58:54
117,SurveySparrow,forms,A form backend that turns forms into conversations.,Forms,,https://startupresources.io/resource/surveysparrow/,2022-02-05 16:58:58
118,Typeform,forms,"I haven’t set one of these up personally, but I’ve used them plenty to give feedback. They’re gorgeous. Typeform simply creates elegant, dynamic forms that can change depending on what responses are given during the process of filling out the form. And it works with Zapier, so you can take that data and send it to Slack or Mailchimp or wherever your little heart desires.",Forms,,https://startupresources.io/resource/typeform/,2022-02-05 16:59:02
119,PHPMailer,forms,"I wanted to have a basic, classic PHP mailer in this list as an option, and this is a popular one on GitHub. Similar to using something like Formspree, PHPMailer is going to be both more flexible and also more complicated to set up. I don’t really know PHP myself but I’ve been able to set these up before. Give it a shot if you need a form on a non-Wordpress site.",Forms,,https://startupresources.io/resource/phpmailer/,2022-02-05 16:59:07
120,Formspree,forms,"If you have a static site, you have less options for forms. But Formspree is super easy to set up. Just add HTML code and you’re good to go. They handle the actual transmission. It’s not the most flexible system in the world, but it’s quick and easy. It’s what I am currently using on this site. It’s easy to set up a honeypot, but there’s no Captcha option unfortately. But it’s free, which is pretty awesome.",Forms,,https://startupresources.io/resource/formspree/,2022-02-05 16:59:10
121,Gravity Forms,forms,"Gravity Forms works off WordPress, and if you have WordPress installed anywhere on your domain, you can embed one of their forms in a static area of your site. It integrates with Zapier, which makes the possibilities endless for what you do with the form entries. I use it at Vacord Screen Printing to take the information from quote requests and put it as a card in our sales funnel Trello board. You can write that data to a Google Doc or whatever you need. It’s worth the Developer license so that you can use it all your sites.",Forms,,https://startupresources.io/resource/gravity-forms/,2022-02-05 16:59:15
