,title,category,description,tags,other_info,link,time_added
122,Your First Investor,fundraising,It is a curated list of equity free funding options available around the world to help startups grow and succeed.,Fundraising,,https://startupresources.io/resource/your-first-investor/,2022-02-05 16:59:19
123,Top ICO List,fundraising,This is a listing of tons of ICOs that are going on. Good to research if you’re considering an ICO for your own startup.,Fundraising,,https://startupresources.io/resource/top-ico-list/,2022-02-05 16:59:23
124,Republic,fundraising,"A crowdfunding platform, for US startups only. Over $7M has been raised through this platform.",Fundraising,,https://startupresources.io/resource/republic/,2022-02-05 16:59:27
125,Kiva,fundraising,"I actually first learned about Kiva from the Wall Street Journal (how non-techy is that?) and am including them here because of their novel approach to fundraising: Get friends and family (or strangers) to vouch for you by donating at least $25 each, and then get access to up to $10,000 in a no-interest loan. Whatever your friends/family/network can’t provide, Kiva will, in order to get you up to $10k.",Fundraising,,https://startupresources.io/resource/kiva/,2022-02-05 16:59:32
126,Forward Partners,fundraising,"In the UK and have an awesome idea and need funding? Forward Partners invests in companies from the idea stage to the seed stage (post launch). Investing in just an idea sounds insane to me, but they make it work by operating really as an incubator and investing in you and working with your idea to take it from concept to fruition. From Customer Discovery, to development, hiring and fundraising, Forward Partners can bring your UK startup to life.",Fundraising,,https://startupresources.io/resource/forward-partners/,2022-02-05 16:59:36
127,Foundersuite,fundraising,"Foundersuite is a collection of 5 web apps and 80 templates. Foundersuite’s flagship tool is Investor Search + CRM which helps you build a list of target investors and manage your fundraise. Also included are pitch decks, financial models, cap tables, term sheets and much more.",Fundraising,,https://startupresources.io/resource/foundersuite/,2022-02-05 16:59:40
128,Celery,fundraising,"Celery is like a Kickstarter but focuses on pre-orders and crowdfunding for Startups and info products and tech products. Their platform works by adding 2% on top of your regular Stripe or PayPal transactional fees. It also handles delayed payments, referrals, split payments and more.",Fundraising,,https://startupresources.io/resource/celery/,2022-02-05 16:59:44
129,Campus Starter,fundraising,"Campus Starter is a rewards or presales model crowdfunding site (think Kickstarter) that works exclusively with college entrepreneurs. They do this in two ways, 1) by giving a school/club a free ‘white-label’ page within their site for just their entrepreneurs or 2) by allowing a student entrepreneur to list at large. Additionally, Campus Starter offers a founder matching software via an API and access to partners like Open Legal, Xero Accounting and Deluxe for the entrepreneurs to tap into.",Fundraising,,https://startupresources.io/resource/campus-starter/,2022-02-05 16:59:49
130,Send Overnight Mail,graphics,Makes it super easy to send hardcopies of time sensitive docs without leaving your desk.,"Graphics, Productivity",,https://startupresources.io/resource/sendovernightmail/,2022-02-05 16:59:54
131,Zillion Designs,graphics,Zillion Designs is a crowdsourcing platform which provides custom graphic designs through design contests/competition.,Graphics,,https://startupresources.io/resource/zillion-designs/,2022-02-05 16:59:58
132,Vizzlo,graphics,"They aim to let you create designer-grade business graphics easily, such as Gantt diagrams and many more.",Graphics,,https://startupresources.io/resource/vizzlo/,2022-02-05 17:00:02
133,RFclipart,graphics,"RFclipart provides vector images and clipart at an affordable price for graphic design, advertising, presentations and other purposes worldwide. The images are supplied in standard vector format (*.EPS), are fully scalable (a notable feature of vector graphics), provided under a Royalty-Free licenses (images listed as ‘Free Vectors’ are provided under a Creative Commons license). They are priced per image so there is no subscription to manage.",Graphics,,https://startupresources.io/resource/rfclipart/,2022-02-05 17:00:08
134,Draftss,graphics,Draftss is a platform for unlimited graphic design services at a monthly subscription of $259/per month.,Graphics,,https://startupresources.io/resource/draftss/,2022-02-05 17:00:12
135,Stencil,graphics,"On top of being a great image creation for social media marketers, bloggers and small businesses, Stencil also has a Chrome extension that lets users create graphics and images using text and images from any page without ever leaving that site. It’s like Canva but faster to create simple graphics, and with a different pricing model and lots included for free. I used to use Canva but I’ve switched to Stencil.",Graphics,,https://startupresources.io/resource/stencil/,2022-02-05 17:00:16
136,Wordswag,graphics,"If you’re doing marketing for your Startup on Instagram, and posting pictures directly from your phone, you might as well find a tool that allows you to edit the pictures and add text and whatnot right on your phone, yeah? Wordswag simply lets you add text to images before you put them up on social media or your site. Perfect for your hip Instagram account.",Graphics,,https://startupresources.io/resource/wordswag/,2022-02-05 17:00:20
137,TinyPNG,graphics,"StartupResources.io had something like 170 screenshots for the initial build, and that’s the bulk of the storage. TinyPNG took 56 megs worth of those images and reduced them to 10 megs, easily and quickly, and with a cute Panda mascot. That makes a big difference in load time. And there was no visible reduction in image quality.",Graphics,,https://startupresources.io/resource/tinypng/,2022-02-05 17:00:24
138,Picmonkey,graphics,"PicMonkey is popular with bloggers, as well as other online groups, because you can easily edit, manipulate, or collage images via their site. Besides basic stuff like resizing, rotating, and cropping photos, you can do lots of photo effects and retouching right on the site.",Graphics,,https://startupresources.io/resource/picmonkey/,2022-02-05 17:00:28
139,LogoCrisp,graphics,Its awesome because it is the only website that offers a real free logo download option. Users can choose from more than 5000 logo designs that they can customize online & download for free!,Graphics,,https://startupresources.io/resource/logocrisp/,2022-02-05 17:00:32
140,Canva,graphics,Canva is a quick and easy way to create a flyer or a web image by adding text to and modifying templates. I’ve used it for flyers for business events before.,Graphics,,https://startupresources.io/resource/canva/,2022-02-05 17:00:36
141,REVEAL,growthhacking,"REVEAL by Omniconvert is a Customer Data Platform that analyzes your customers’ behavior across multiple channels. Reveal helps you understand how to acquire, retain, and delight your customers while lowering the Customer Acquisition Cost and increasing Customer Lifetime Value.",GrowthHacking,,https://startupresources.io/resource/reveal/,2022-02-05 17:00:41
142,SaaS Pages,growthhacking,Browse 900+ landing page screenshots. We give you the best practices to help you convert more visitors to customers.,"Marketing, GrowthHacking",,https://startupresources.io/resource/saas-pages/,2022-02-05 17:00:45
143,WeGrowth,growthhacking,WeGrowth is an Online Marketplace which connects service providers – Growth Hackers and Marketers with potential clients that need their services. Experts and their services are chosen by a team of marketers and checked out before their service is publicly available. Services cover the entire AARRR funnel.,GrowthHacking,,https://startupresources.io/resource/wegrowth/,2022-02-05 17:00:49
144,Growth Geeks,growthhacking,"Growth Geeks is sort of like e-lance for anyone who can help grow your business. You can hire people to grow your social media audience, provide sales leads, write blog posts, help analyze your traffic and look for opportunities, and a ton more. It’s an easy way to find a quality contractor to help you out.","Hiring, GrowthHacking",,https://startupresources.io/resource/growth-geeks/,2022-02-05 17:00:57
145,Growthhacker.tv,growthhacking,"‘Because hustlers don’t watch cable’ is their slogan. Hosted by Bronson Taylor, Growthhacker.tv interviews successful growth hackers and people who have made their Startups take off and gets them to share how and why they did what they did. You can always watch or listen to the most recent episodes for free, and for a premium access the backlog of 200 or so episodes. It’s inspirational and actionable, and it’s what I watch while I cook dinner at night. Because as a hustler I obviously do not watch cable.",GrowthHacking,,https://startupresources.io/resource/growthhacker-tv/,2022-02-05 17:01:01
146,Growthority,growthhacking,"Similar to vytmn, Growthority takes over the early stage growth for many startups. It’s basically outsourcing your startup’s growth hacking needs to an outside team that will focus on it and deliver for you. If you can’t spend a lot of time on marketing/ growth hacking, or you’re not sure you have the skills necessary and don’t want to bring someone in house, Growthority may be right for you.",GrowthHacking,,https://startupresources.io/resource/growthority/,2022-02-05 17:01:05
147,Abhisi – All-in-One Sales and Support Software,helpdesks,"Very cost-effective all-in-one customer support tool. Live Chat, Facebook, Twitter, Messenger, Email, SMS, Phone and online knowledge base. Also has a free plan.",HelpDesks,,https://startupresources.io/resource/abhisi-all-in-one-sales-and-support-software/,2022-02-05 17:01:10
148,Live Agent,helpdesks,"Combining the usual email help desk approach with live chat, Live Agent treats issues as ‘tickets’ and has a huge amount of features to take care of all your customers’ issues, including gamification if you want to reward your support staff as they help more and more people. There’s also knowledge bases, articles, call center compatibility with Twilio, and API integration with Zapier. Pricing is reasonable, and if you have a ton of support agents you can save money in the long run by buying a one time license for the system.",HelpDesks,,https://startupresources.io/resource/live-agent/,2022-02-05 17:01:14
149,Freshdesk,helpdesks,"If you find yourself doing customer service for your Startup, and answering the same questions over and over, Freshdesk can help reduce the workload by having scripted answers to common questions, as well as managing the the service requests with ticketing and tracking. Systems like this are great because it allows you to scale your support team well, or outsource it once you can’t, or don’t want to, handle it yourself.",HelpDesks,,https://startupresources.io/resource/freshdesk/,2022-02-05 17:01:18
150,Recruitee,hiring,Really good looking cloud app for recruiting. It really streamlines your recruitment process and makes it possible to collaborate on hires with everybody involved in the process.,Hiring,,https://startupresources.io/resource/recruitee/,2022-02-05 17:01:22
151,50skills,hiring,"50skills is a modern all-in-one recruiting platform that helps employers build and post jobs, source and manage candidates, make the right hire and onboard new candidates in a collaborative effort.",Hiring,,https://startupresources.io/resource/50skills/,2022-02-05 17:01:26
152,Team Extension,hiring,"Many companies — both large and small — have faced challenges with finding talented developers including candidate qualifications, team dynamics, and bottom-line financials. Team Extension provides quality developers from Eastern Europe, with both great technical and communication skills.",Hiring,,https://startupresources.io/resource/team-extension/,2022-02-05 17:01:34
153,Good Audience,hiring,"Tired of managing all your social media? Don’t want to bring someone onto your team full time to do it? Good Audience provides a management team to handle your social media, giving you back hours every week. Let them focus on crafting and posting content, and responding to your fans, while they bring you leads and manage your social media for you. Want to work with them? Ask me for a personal introduction.","Hiring, SocialMedia",,https://startupresources.io/resource/good-audience/,2022-02-05 17:01:41
154,Equity Directory,hiring,"Looking to hire for equity? Willing to work at a Startup for equity? Equity Directory is the first and only employment connection site that focuses on working for equity. (And don’t worry about starving, companies who hire via Equity Directory can pay you a salary plus equity, so it’s not always working for only equity.) A fast growing service that fills a huge niche in the hiring world previously ignored, Equity Directory is definitely worth checking out.",Hiring,,https://startupresources.io/resource/equity-directory/,2022-02-05 17:01:45
155,Fiverr,hiring,"If you have a small job you need done, check Fiverr to hire someone for as little as $5 to do your one off job. I have personally hired actors from the site, as well as SEO consultants, graphic designers, and copywriters. There’s a ton of stuff on there. Note that a lot of jobs cost more than $5, but all services offered are affordable. And you can get one free gig when you join Fiverr via this special link.",Hiring,,https://startupresources.io/resource/fiverr/,2022-02-05 17:01:49
156,Virtual Collective,hiring,"In the Four Hour Work Week, Tim Ferriss talks about having an outsourced team that manages every aspect of your business while you sit on the beach. Virtual Collective actually provides that team. Whether you’re looking to hire a copywriter, social media manager, developer, or all of the above and more, Virtual Collective can provide them, and since they’re all hired from the same source, they can manage communication between workers so that you don’t have to, which leads to a more cohesive and effective Startup team.",Hiring,,https://startupresources.io/resource/virtual-collective/,2022-02-05 17:01:53
157,Flaskmail,hosting,This is a really easy way to get email on a custom domain. You can either bring your own domain or purchase one through them. Reasonable pricing.,Hosting,,https://startupresources.io/resource/flaskmail/,2022-02-05 17:01:57
158,WP Engine,hosting,"Do you only host a WordPress site? Or are you an agency that hosts a ton of WordPress sites for your clients? Then going with a host that specializes in hosting WordPress makes sense, and that’s exactly what WP Engine does. And since they only do WordPress hosting, if you ever need support with your site, they are experts in trouble shooting WordPress issues.",Hosting,,https://startupresources.io/resource/wp-engine/,2022-02-05 17:02:01
159,Rackspace,hosting,"Are you the kind of Startup person that wants to manage your own server? Rackspace might be best for you then. They can manage your server for you, as well, and they have new cloud management packages too. In my experience, they have tireless support that will spend as much time as needed with you. And they run their corporate office out of an old shopping mall, which is fun.",Hosting,,https://startupresources.io/resource/rackspace/,2022-02-05 17:02:06
160,HostGator,hosting,"If you’re looking for powerful yet affordable hosting or VPS, and you want that host to have a mascot that looks like he would be fun to rage with at a frat party, HostGator just may be your top choice. They also offer one click installs, and a ton of free templates to choose from.",Hosting,,https://startupresources.io/resource/hostgator/,2022-02-05 17:02:10
161,Digital Ocean,hosting,"I’ve hosted Startups at different places, including AWS (too expensive!) but now I’m using Digital Ocean to host startups and it’s very affordable, well designed, and has nice support. I’m not that savvy with setting up server stuff, but I was able to figure out everything I needed to do with their knowledge base. Individual virtual servers start at just $5 each. You can use this link for $10 off your account.",Hosting,,https://startupresources.io/resource/digital-ocean/,2022-02-05 17:02:14
162,bluehost,hosting,"A very well known hosting provider, with plans starting currently at only $3.49 a month, which is cheaper than a Latte. Their unlimited plans are also affordable. I’ve never used them personally, but I know a lot of people start with bluehost.",Hosting,,https://startupresources.io/resource/bluehost/,2022-02-05 17:02:18
163,Leadiro,leads,"Leadiro is a B2B data provider to find companies, contacts and intelligence on their technology stack.",Leads,,https://startupresources.io/resource/leadiro/,2022-02-05 17:02:22
164,prospect.io,leads,List building tool with LinkedIn integration and an intelligent way of integrating with multiple CRMs.,Leads,,https://startupresources.io/resource/prospect-io/,2022-02-05 17:02:26
165,Tweetfull,leads,"TweetFull is a Twitter automation tool that follows people and favorites tweets based on the hashtags and specifics you want. I put it in the Leads category instead of Social Media because their approach is designed to bring you people interested in your offering, who you can then start marketing to.",Leads,,https://startupresources.io/resource/tweetfull/,2022-02-05 17:02:30
166,Sellhack,leads,"Let’s say you know the CMO’s name at a certain company, but you can’t find their email address. Take the information you do know and input it into Sellhack and it will tell you what their email address is, and to what percentage they are certain about it. They now also have a Chrome extension to automatically look up this information as you browse. Sign up via our special link here and get 50 extra credits (a credit is good for one email look up).",Leads,,https://startupresources.io/resource/sellhack/,2022-02-05 17:02:33
167,Pipetop,leads,"Limited in scope, but in a way that can provide better verified leads, Pipetop only works in four verticals: consumer brands, e-commerce, software / IT companies, and creative agencies. So if your targets would be in one of those verticals, you’re set. With the mentality of ‘not all leads are created equal’, Pipetop wants to only give you high quality leads.",Leads,,https://startupresources.io/resource/pipetop/,2022-02-05 17:02:37
168,LeadFuze,leads,"LeadFuze is a very affordable lead service, with a very high accuracy rate. They can either sell you the leads, and you can pursue them yourself, or they have a ‘done for you service’ in which they provide the leads and initially contact them, to your specifications, then pass them off to you if they’re interested, which is awesome if you’ve got the funds to pay for such a service but you don’t have the time to do it yourself, or if your time is better spent doing something else for your Startup. I plan to use LeadFuze for my own business as part of my ‘Growvember’ marketing onslaught.",Leads,,https://startupresources.io/resource/leadfuze/,2022-02-05 17:02:40
169,Import.io,leads,"Import.io is a scraping tool with a function called ‘magic’ which is an appropriate name because it operates like magic. Show it a website, point to a bit of data, tell Import.io what you want to call that data, point to other data, name it too, and so on, and Import.io learns how to intelligently scrape and place all that data into a CSV for you. And it can do it in batches, huge batches. It will work better than your Malaysian virtual assistant. I was extremely impressed. And it’s free. If you want to pull information of webpages in order to gather leads, this is the tool for you.",Leads,,https://startupresources.io/resource/import-io/,2022-02-05 17:02:44
170,Startup Lister,listingservices,"Similar to PromoteHour, Startup Lister will submit your Startup to up to 100+ blogs, news outlets and start websites, and help get the word out. The big difference is that they’re not just listing you in directories, but instead pitching you to news outlets as well.",ListingServices,,https://startupresources.io/resource/startup-lister/,2022-02-05 17:02:52
171,PromoteHour,listingservices,"A list of the best places to submit your startup, plus they have three different tiers of submission if you want them to save you hours of time by submitting to 30 or 50 directories.",ListingServices,,https://startupresources.io/resource/promotehour/,2022-02-05 17:02:56
172,DesignEvo,logos,More of an editor for logos than an automated logo generator. Free to use.,Logos,,https://startupresources.io/resource/designevo/,2022-02-05 17:03:01
173,Logomaster.ai,logos,Logo builder that helps business founders create professional logo designs as fast as they can. Use code STARTUPRESOURCES30 at checkout for a 30% discount!,Logos,,https://startupresources.io/resource/logomaster-ai/,2022-02-05 17:03:05
174,BrandCrowd,logos,"BrandCrowd’s logo maker combines a huge library of premium, unique handcrafted logos with an advanced logo editor. BrandCrowd produces higher quality, more unique logos for startup and entrepreneurs than other logo makers. Most logo maker tools use free clip-art icons from libraries like the noun-project while BrandCrowd’s unique designs are sourced from top designers from around the world.",Logos,,https://startupresources.io/resource/brandcrowd/,2022-02-05 17:03:08
175,99designs,logos,99designs is a great resource for logos. They help everyone design a logo from the conception to the creation providing top design knowledge and connecting with the biggest online community of designers. Run contests and get people to vote on what they think is the best design.,Logos,,https://startupresources.io/resource/99designs/,2022-02-05 17:03:13
176,Logogarden,logos,"Logogarden lets you make a logo for free, but it’s $12 or so to download a high quality version of it. We used LogoGarden at a previous startup to easily and quickly come up with a very professional looking logo. I’d recommend it most out of these three logo tools.",Logos,,https://startupresources.io/resource/logogarden/,2022-02-05 17:03:17
177,Logojoy,logos,"Logojoy is better than other logo creators because it employs AI to learn what design elements work well together in order to guide you intelligently through the process of creating your logo. Their free, easy-to-use online logo maker helps you create an amazing logo in seconds. No design experience necessary.",Logos,,https://startupresources.io/resource/logojoy/,2022-02-05 17:03:21
178,Logomakr,logos,"A more interesting UI than the others, Logomakr lets you whip up a logo using their clipart and online tool, and then it’s free to use elsewhere on the web.",Logos,,https://startupresources.io/resource/logomakr/,2022-02-05 17:03:25
179,Logopony,logos,"A fast and easy way to come up with a logo, with an intuitive designer interface that is as slick as Illustrator in some ways. Choose from tons of basic shapes, clipart and fonts to put together a pro looking logo in hardly any time. Download a 300×300 image for free (which is big enough for site logos and favicons) or download a vector version for cheap.",Logos,,https://startupresources.io/resource/logopony/,2022-02-05 17:03:29
180,Logaster,logos,"Logaster is one of the best sites which you can use to create logo online. It gives you professional looking logo. All you need is to enter a name and add a business type. The service generates dozens of logo concepts to choose from. You are free to to edit or download as is. Logaster supports popular image formats such as PNG, PDF, SVG, and of course, JPEG. Note that creating a beautiful logo is as simple as a few steps. It’s aim is for anyone without designs skills whatsoever to be able to create a professional logo. Logaster also allows you to create favicons, business cards, envelopes and blanks.",Logos,,https://startupresources.io/resource/logaster/,2022-02-05 17:03:33
181,Graphic Springs,logos,"Create a logo using their system by choosing from designs, shapes, etc. If you like what you came up with, pay $39.99 to download a high quality version. It’s free to go back and edit it afterwards, if you need.",Logos,,https://startupresources.io/resource/graphic-springs/,2022-02-05 17:03:37
182,Smash Digital,marketing,"Smash Digital is an agency focusing on providing startups with super high-quality link building, SEO services, and all the guidance necessary to bring in buckets of qualified traffic needed to grow.",Marketing,,https://startupresources.io/resource/smash-digital/,2022-02-05 17:03:41
183,#saashacker,marketing,"#saashacker is a weekly, actionable SaaS marketing case study, sent by email.",Marketing,,https://startupresources.io/resource/saashacker/,2022-02-05 17:03:49
184,Paved,marketing,"Email marketing and sponsored content, simplified. Find newsletters with subscriber profiles that fit your needs, and advertise with them.",Marketing,,https://startupresources.io/resource/paved/,2022-02-05 17:03:54
185,Pompify,marketing,"Going to a conference? Pompify creates custom displays for startups, companies, and organizations. Fast 48 hour production and free shipping.",Marketing,,https://startupresources.io/resource/pompify/,2022-02-05 17:04:01
186,Dilate,marketing,Dilate is a full-service digital marketing agency that delivers a wide range of digital marketing strategies for their clients.,Marketing,,https://startupresources.io/resource/dilate-agency/,2022-02-05 17:04:05
