,title,category,description,tags,other_info,link,time_added
0,Mindnet Analytics,analytics,This is a media monitoring system for small businesses that lets you monitor both social and traditional media for your brand. Very useful.,"Analytics, Outreach, SocialMedia",,https://startupresources.io/resource/mindnet-analytics/,2022-02-05 16:50:01
1,Plausible,analytics,"Plausible is a lightweight, non-intrusive alternative to Google Analytics that preserves privacy and loads faster than GA. Free trial, then starts at $6/month.",Analytics,,https://startupresources.io/resource/plausible/,2022-02-05 16:50:05
2,App Radar,analytics,App Radar is an online tool that helps app developers understand and optimize their app store appearance. It comes with useful keyword tracking & research functionality and is the first tool that lets them publish and manage app store listings for both Google Play & Apple App Store in one place. It lets app owners use the full potential of their app to get it to more users.,Analytics,,https://startupresources.io/resource/app-radar/,2022-02-05 16:50:10
3,Metrica,analytics,"Yandex, the Russian equivalent of Google, has released their own expansive analytics tool called Metrica. More expansive and with better looking reports, some people choose Metrica over Google Analytics for privacy concerns.",Analytics,,https://startupresources.io/resource/metrica/,2022-02-05 16:50:13
4,Keen.io,analytics,"With more of a focus on embedded analytics and whitelabel-ready reports that you can pass to clients, Keen.IO focuses on Key Performance Indicators for teams and companies.",Analytics,,https://startupresources.io/resource/keen-io/,2022-02-05 16:50:16
5,Hotjar,analytics,"An analytical tool focused on finding areas of opportunity and potential growth, Hotjar also helps with Conversion Rate Optimization. It’s a very complete package for a very affordable price.",Analytics,,https://startupresources.io/resource/hotjar/,2022-02-05 16:50:20
6,ClickMeter,analytics,"Use ClickMeter to track clicks on all your links on your site, which allows you to see how popular the links on your site are, and which perform the best. This helps you figure out what material is most interesting and engaging to your visitors. It’s easy to set up, by just replacing links on your site with tracking links that have the same ultimate destination. There’s even a free plan if you have less than 1000 events (clicks) on your site a month.","Analytics, Conversion",,https://startupresources.io/resource/clickmeter/,2022-02-05 16:50:24
7,Baremetrics,analytics,"Providing financial analytics so that you can monitor growth and churn, Baremetrics is an essential tool if you use Stripe.",Analytics,,https://startupresources.io/resource/baremetrics/,2022-02-05 16:50:27
8,VWO,analytics,"Very affordable and offering a load of features, VWO (visual website optimizer) offers everything the other A/B testing platforms offer, but at a lower price. Build your site with VWO and test everything to improve conversion and results.",A/BTesting,,https://startupresources.io/resource/vwo/,2022-02-05 16:50:31
9,Unbounce,abtesting,"Focused more on landing pages, Unbounce lets you build high converting pages with testing and optimization. Start with one of their proven landing page templates and go from there. Also, the Unbounce mailing list is a goldmine of quality articles on conversion.",A/BTesting,,https://startupresources.io/resource/unbounce/,2022-02-05 16:51:40
10,Optimizely,abtesting,"A company that has been around for quite a while, Optimizely was the first company I learned about in an A/B testing class way back when in 2009 at Philly BarCamp. With plans to let you test your site over and over to refine, Optimizely lets you fine tune your pages to optimize conversion and meet your goals.",A/BTesting,,https://startupresources.io/resource/optimizely/,2022-02-05 16:51:44
11,changeagain.me,abtesting,"With a name that reminds you how you have to Always Be Testing, ChangeAgain calls themselves the most cost effective A/B tool. Integrates with Google Analytics in one click, and has an easy to use visual editor. No limit on traffic.",A/BTesting,,https://startupresources.io/resource/changeagain-me/,2022-02-05 16:51:47
12,AB Tasty,abtesting,"AB Tasty helps marketers tailor user-​​experience and increase conversion rates through A/​B testing and content personalisation. A user-​​friendly and interactive SaaS-​​solution, AB Tasty makes it easier to compare different designs of a page – regardless of technical skills. By using AB Tasty’s intuitive editor and visual reporting, marketers can easily apply changes to their websites, collect valuable customer data in real-​​time and make data-​​driven decisions based on reliable statistics.",A/BTesting,,https://startupresources.io/resource/ab-tasty/,2022-02-05 16:51:51
13,Veeroll,advertising,"Easily create high converting video ads and video ad campaigns for Facebook and YouTube. Veeroll allows a newbie in video advertising, professional video advertisers or digital agencies to create video ads in minutes without any video editing. It’s free to start, and they have guides on making video advertising as affordable as possible.",Advertising,,https://startupresources.io/resource/veeroll/,2022-02-05 16:51:55
14,Traffic Junky,advertising,"Scoring big with an unconventional advertising campaign is never easy. You’d have to be as original and quirky as possible, but the risk of failing is still too high.",Advertising,,https://startupresources.io/resource/traffic-junky/,2022-02-05 16:51:58
15,Retargeter,advertising,"Ad retargeting is all the rage right now for online marketing, and for good reason: It’s relatively cheap and very effective. But it’s not the most intuitive thing to figure out. Retargeter manages your retargeting ad campaigns for you.",Advertising,,https://startupresources.io/resource/retargeter/,2022-02-05 16:52:02
16,Perfect Audience,advertising,"Perfect Audience is an ad management system that focuses on retargeting, one of the most effective methods of online advertising. One thing that is awesome about Perfect Audience is that its pricing is based on volume, so they just charge on top of what you spend with Facebook or Google ads, which is nice because then you pay for the service based on how much you use it. Highly recommended if you’re advertising with retargeting.",Advertising,,https://startupresources.io/resource/perfect-audience/,2022-02-05 16:52:05
17,Automate Ads,advertising,"Automate Ads puts ‘digital advertising on autopilot’, allowing you to manage and optimize all your online marketing in one place. Their system can A/B test your ads and automatically start using the ones that perform the highest, as well as rotate ads automatically to prevent ad fatigue to your audience. Pricing is based on your overall ad spend through their system.",Advertising,,https://startupresources.io/resource/automate-ads/,2022-02-05 16:52:09
18,AdEspresso,advertising,Running variations on Facebook ads is important to fine tune your campaigns so that you get the most bang for your buck. You know that Facebook Power Editor kind of sucks. AdEspresso makes A/B testing ads a whole lot easier.,Advertising,,https://startupresources.io/resource/adespresso/,2022-02-05 16:52:12
19,GrowthMentor,advice,GrowthMentor is a platform that makes it easy for you to schedule 1:1 calls with high level growth marketers and startup mentors.  Work through issues you are having and come up with actionable solutions with their help!,Advice,,https://startupresources.io/resource/growthmentor/,2022-02-05 16:52:16
20,Trends,advice,Trends is a subscription email service that provides weekly reports on up-and-coming market opportunities with actionable insights.,"Research, Advice",,https://startupresources.io/resource/trends/,2022-02-05 16:52:20
21,Clarity,advice,"Ever wish you could call up a Startup expert or a growth hacker, like a 900 number back in the 90s and spend $X a minute getting their advice or feedback on your project?",Advice,,https://startupresources.io/resource/clarity/,2022-02-05 16:52:23
22,Rewardful,affiliate,"Rewardful is a simple way for SaaS companies to setup affiliate and referral programs with Stripe. Just connect your account and they will track referrals, discounts, and commissions for you.",Affiliate,,https://startupresources.io/resource/rewardful/,2022-02-05 16:52:27
23,AffiliateFeeds.com,affiliate,"Builds a pre-designed affiliate feed website for you. Just buy a domain name, plug in feeds and filter them however you want, the rest is taken care of.",Affiliate,,https://startupresources.io/resource/affiliatefeeds-com/,2022-02-05 16:52:30
24,Tapfiliate,affiliate,"There’s a lot of affiliate systems out there, but they nearly all look like they were created in 2003.",Affiliate,,https://startupresources.io/resource/tapfiliate/,2022-02-05 16:52:34
25,Referral Saasquatch,affiliate,"Not exactly an affiliate system, Saasquatch is more focused on getting your customers to refer other people to your service in order to be rewarded. It could be awesome to combine this with an affiliate program like LeadDyno, so that both your customers and affiliate marketers are working to build your business for you.",Affiliate,,https://startupresources.io/resource/referral-saasquatch/,2022-02-05 16:52:37
26,Shareasale,affiliate,"Another popular affiliate system, although not as refined as LeadDyno, Shareasale seems to have a bigger network, and is more heavy on data and analytics, although their fee structure may be a bit heavier too. However, overtime, the lack of a monthly fee can make Shareasale a cheaper option that LeadDyno, which charges $49 to $79 a month for the system. Weigh your options and bust out your calculator and figure out which is best for you.",Affiliate,,https://startupresources.io/resource/shareasale/,2022-02-05 16:52:41
27,Post Affiliate Pro,affiliate,"After seeing so many affiliate systems and dashboards, Post Affiliate Pro is now my favorite system. It’s got a ton of features and it’s great pricing for a lot of affiliates/traffic. Also, if you are the brave type and want to host it on your own server, you can get the system for a one time fee, and then just run it yourself, and not have to pay a recurring fee, which is very economical.",Affiliate,,https://startupresources.io/resource/post-affiliate-pro/,2022-02-05 16:52:44
28,LeadDyno,affiliate,"An affiliate program, with the classic setup in which you give a certain percentage of sales to the site that originated the traffic. It’s easy to set up the page for your affiliates, and there are a ton of companies using it. Fairly modern design and quick support make it stand out among a sea of outdated affiliate system offerings with design styles from the late 90s.",Affiliate,,https://startupresources.io/resource/leaddyno/,2022-02-05 16:52:48
29,Growsumo,affiliate,"A much newer system with a beautiful backend interface, Growsumo went through Y Combinator recently and has mostly modern Startups as its clientele. It does not yet manage actually paying out, like most of these systems do, but it does track how much you owe affiliates, and then you could just pay your affiliates with Venmo, Paypal, a check, or whatever you want. It’s definitely the most elegant of all the affiliate systems we’ve seen. No upfront costs, they just charge 3% of the value of the account gained from the system.",Affiliate,,https://startupresources.io/resource/growsumo/,2022-02-05 16:52:51
30,Zapier,automation,"Born out of a Startup Weekend, Zapier connects a ton of APIs together, enabling you to connect all sorts of tools. For example, make a new entry from Gravity Forms automatically turn into a Trello card in your sales funnel, or get notified in Slack when a customer unsubscribes so that your team knows to do an exit interview. The possibilities are endless.",Automation,,https://startupresources.io/resource/zapier/,2022-02-05 16:52:55
31,Simplycast,automation,"Simplycast has a CRM, plus landing pages, and marketing automation for various social media platforms. It’s got an overwhelming about of tools and features, and is a pretty vast marketing solution in itself.",Automation,,https://startupresources.io/resource/simplycast/,2022-02-05 16:52:58
32,Quuu,automation,"If you use Buffer to queue up content to go to your Twitter or Facebook, you probably know the power of that. You probably also know the terror when your Buffer queue runs dry and the river of content becomes barren. Quuu is a godsend if you queue up content to your Buffer, because their service automatically adds curated articles to your Buffer for you. Choose from a few different categories relevant to your audience, set it and forget it. Brilliant.",Automation,,https://startupresources.io/resource/quuu/,2022-02-05 16:53:02
33,Mailparser.io,automation,It’s like import.io but lets you extract lead data from incoming e-mails. Our customers use it in combination with lead platforms which send them hundreds of machine generated e-mails. mailparser.io lets you extract those leads and send them to a spreadsheet or to Zapier.,Automation,,https://startupresources.io/resource/mailparser-io/,2022-02-05 16:53:05
34,IFTTT,automation,"Much simpler to set up than Zapier but much more limited in scope, IFTTT works by saying ‘If This Then That.’ Set it up so that if you post an image to Instagram, it also goes to your Buffer queue for Twitter and to your company’s Facebook, or if there is rain in the forecast it can remind you to grab an umbrella.",Automation,,https://startupresources.io/resource/ifttt/,2022-02-05 16:53:09
35,Stripe Billing,billing,"Stripe’s take on recurring business models looks really powerful, they can take care of invoicing in the same type of really smart, customer-friendly way they were already doing online payments, you can do wire payments and ACH and still have Stripe notice the payment (it sets up virtual bank accounts for receiving), you can do all types of billing models, etc. and the pricing is great – free for the first million dollars, then 0.4% on top of their payment processing fee. They still don’t do quite everything that a provider like Chargebee or Chargify does, but they’re getting pretty close.",Billing,,https://startupresources.io/resource/stripe-billing/,2022-02-05 16:53:13
36,LessChurn,billing,"LessChurn helps your users right before they delete their account by providing them detour options instead, such as extending their trial or applying a coupon. Integrates with Stripe.",Billing,,https://startupresources.io/resource/lesschurn/,2022-02-05 16:53:16
37,Recurly,billing,"Focused on subscription payments, Recurly manages many payment options and subscriptions, including ACH. It’s lightweight but powerful, with a lot of automation potential, and an extremely wide range of offerings.",Billing,,https://startupresources.io/resource/recurly/,2022-02-05 16:53:20
38,Quaderno,billing,"Have a variety of payment systems? Customers both domestic and overseas? Have some legacy cusotmers still paying with older methods? Quaderno pulls your myriad of payment processes together, issues beautiful invoices, and makes tax time easier by putting everything in a single location.",Billing,,https://startupresources.io/resource/quaderno/,2022-02-05 16:53:23
39,Cashboard,billing,"An invoicing system with everything you really need and not a lot of unwanted features, Cashboard works with Authorize.net or other payment systems to actually let your customers pay. Sending invoices to clients is easy, and it’s easy for them to use the site to pay as well, which is critical. We’ve used it for three years now, no complaints. I like how easy it is to sort and export payment and customer data.",Billing,,https://startupresources.io/resource/cashboard/,2022-02-05 16:53:27
40,Chargeover,billing,"ChargeOver provides awesome subscription billing services for startups, offering both a GUI and a RESTful API. Automatically charge customers on whatever schedule you need, and allow them to pay their way (credit, PayPal, ACH). One-off charges, metered billing, trials, and discounts are all in ChargeOver’s wheelhouse. If you can build it, we can bill it, automatically. (Reduced pricing available for early stage startups.)",Billing,,https://startupresources.io/resource/chargeover/,2022-02-05 16:53:30
41,Chargify,billing,Chargify streamlines subscription management and recurring billing for thousands of businesses from startup to Fortune 500.,Billing,,https://startupresources.io/resource/chargify/,2022-02-05 16:53:33
42,How to Start a Blog: 5 Easy Steps To Start Blogging,blogging,Probably one of the most comprehensive guides to starting a blog we’ve ever seen. ,Blogging,,https://startupresources.io/resource/how-to-start-a-blog-5-easy-steps-to-start-blogging/,2022-02-05 16:53:37
43,Giggrabbers,blogging,A resource for finding effective writers that can create blog content for your company. You’ll have several options to choose from and many of the writers are college grads or professionals who are passionate about writing. Articles can be written for $25 a pop to $45 based on what you need.,Blogging,,https://startupresources.io/resource/giggrabbers/,2022-02-05 16:53:41
44,Quuu Promote,blogging,"This is the easiest and absolutely one of the most cost effective ways I’ve found to promote content. You submit your content, choose a category, and as long as it’s not too sales-y they usually approve it. It is then used to feed the content feeds of all the lovely folks using Quuu to fill their social media feeds with good stuff.","Blogging, GrowthHacking, ListingServices, Marketing, SocialMedia",,https://startupresources.io/resource/quuu-promote/,2022-02-05 16:53:44
45,Medium,blogging,"Hugely popular within the Startup community, Medium has a beautifully elegant web editor. It’s a great place to post if you don’t want to host your own blog, and it’s easy to grow a following within the very active community.",Blogging,,https://startupresources.io/resource/medium/,2022-02-05 16:53:47
46,Growth Geeks Blogging Gigs,blogging,"Content Marketing is crucial these days, and blogging is awesome, but it’s definitely time intensive. If you don’t want to spend the time or energy on it, you could always outsource blogging. It’s difficult to find a quality writer, but Growth Geeks offers ten different blogging related gigs, from two articles a month for just $79, up to eight premium posts a month.",Blogging,,https://startupresources.io/resource/growth-geeks-blogging-gigs/,2022-02-05 16:53:51
47,Art of the Start 2.0,books,"This revised version of Guy Kawasaki’s business classic is a lot longer, and covers entrepreneurship and what it really takes to start a company, including bootstrapping techniques and how to pitch your idea to investors.",Books,,https://startupresources.io/resource/art-of-the-start-2-0/,2022-02-05 16:53:57
48,Built to Sell,books,"A set of valuable business lessons disguised as a story, Built to Sell tells the tale of an ad agency which restructures itself as a service in order to teach why you should build a precise service that you market instead of building a consulting firm or agency. It also focuses on how to structure a business that is not dependent on you at its core, vital for anyone with a Startup who has an exit as the end goal, or just any business owner who may still want to have a personal life.",Books,,https://startupresources.io/resource/built-to-sell/,2022-02-05 16:54:01
49,Influence,books,"An amazing book on how to influence others that might as well be called ‘How To Manipulate People So That They Do Whatever You Want But Hold On, I Swear That’s Not As Evil As It Sounds.’ Read this book if you want to learn how to get people to return favors, feel inclined to convert, and help you out on your path to success.",Books,,https://startupresources.io/resource/influence/,2022-02-05 16:54:05
50,Lean Startup,books,"Written by the Godfather of Lean, The Lean Startup has sparked a revolution in entrepreneurship, leading to methodologies to create more profitable companies for cheaper with more likelihood to succeed. That is, if you stick to the tried and true methods taught in this book.",Books,,https://startupresources.io/resource/lean-startup/,2022-02-05 16:54:10
51,Traction,books,"Covering an exhaustive list of the 19 traction channels, Traction is THE Bible for Startups as far as making progress in getting new users and customers go. Everything is covered. This book took me a while to get through, because every time I sat down to read it I got inspired to pursue some new traction idea, and would put the book down to go take action. It’s a must for your bookshelf.",Books,,https://startupresources.io/resource/traction/,2022-02-05 16:54:14
52,KingSumo,contests,"KingSumo is a popular wordpress plugin that creates a standalone page on your blog (it can also be installed by itself in a wordpress directory if you have an otherwise static site). It’s somewhat limited in features, but the interesting thing about KingSumo is that it encourages sharing the contest with others, because the participant gets extra entries for every person that they get to also sign up. Which means the more people they bring in, the better their chances of winning, and hence the encouragement of virality for your competition.",Contests,,https://startupresources.io/resource/kingsumo/,2022-02-05 16:54:19
53,Gleam,contests,"More than just the viral contest portion, Gleam is a suite of marketing apps which includes sweepstakes management and rewards for users, focused on running beautiful competitions on your own site.",Contests,,https://startupresources.io/resource/gleam/,2022-02-05 16:54:24
54,DailyStory,conversion,"DailyStory equips your team with a single, turn-key, customer engagement solution that provides the services, tools, and expertise you need to build, nurture, and grow your customer relationships. There are no tedious or complex technologies to integrate together – they take care of all of that for you – enabling you to stay focused on your business and your customers.",Conversion,,https://startupresources.io/resource/dailystory/,2022-02-05 16:54:30
55,userinput.io,conversion,"Want to get feedback on an idea, or test the desire for a project you’re thinking about building out? You can submit your idea to userinput.io and get opinions and feedback from 10, 25 or 50 people quickly and see their thoughts on your idea. Make the research more targeted by specifying age, industry, gender, location, or whatever demographic you need.","Conversion, CustomerDiscovery, Research",,https://startupresources.io/resource/userinput-io/,2022-02-05 16:54:34
56,Weekly Conversion Hacks,conversion,"You need to improve conversion on all your websites, but there’s so much information out there that it’s hard to know where to start. Get a free super-actionable lesson on conversion every week for about 20 weeks straight, leading you through the process of analytics, customer research, implementation, testing, and psychology. Learn what tools to make it easier, and what processes will for sure help increase your conversion rate with time.",Conversion,,https://startupresources.io/resource/weekly-conversion-hacks/,2022-02-05 16:54:40
57,UserBob,conversion,UserBob provides affordable user testing of your website or app. Enter your URL and UserBob will recruit users to visit your site and record a video of their experience as they talk out loud about what they are thinking.,Conversion,,https://startupresources.io/resource/userbob/,2022-02-05 16:54:44
58,Conversion Checklist,conversion,"A 41 point checklist to make sure you have everything covered necessary to make your site earn as much and convert as well as possible. Whether you’re just getting started with conversion rate optimization, or a seasoned veteran, use this checklist to make sure you’re doing everything you should to have your site convert well.",Conversion,,https://startupresources.io/resource/conversion-checklist/,2022-02-05 16:54:51
59,Teamgate CRM,crms,"Teamgate is an inbound CRM designed specifically for startups and SMBs . Teamgate offers all lead generation and sales management functions. Your business will benefit from powerful insights, implemented SmartDialer and a wide API connection range. Award-winning for its ease of use, Teamgate is the only Sales CRM for fast-growth service businesses helping them to connect, research, present and close more inbound leads with a guaranteed increase in success rate at a very competitive price.",CRM,,https://startupresources.io/resource/teamgate-crm/,2022-02-05 16:54:55
60,Freshsales CRM,crms,"Freshsales CRM has AI-based lead scoring, built-in phone, email, activity capture and more. They have a free plan for up to 10 users.",CRM,,https://startupresources.io/resource/freshsales-crm/,2022-02-05 16:55:01
61,Leadscore,crms,"Leadscore is awesome because it combines an email marketing platform, sales force automation, and CRM all into one single tool. It’s competitively priced and powerful, so it’s perfect for small businesses and startups.",CRM,,https://startupresources.io/resource/leadscore/,2022-02-05 16:55:05
62,Springbot,crms,"Automatically brings in demographic data to segment customers, and has amazing integrations with e-commerce to customize communicatoins.",CRM,,https://startupresources.io/resource/springbot/,2022-02-05 16:55:09
