,title,category,description,tags,other_info,link,time_added
247,Taskiness,productivity,"Taskiness is a natural language processing to-do list that turns your text notes into a to-do list. If you keep ending up with a text file as your to-do list, this may be for you. It lets you organize your notes the way you want, it processes your natural language, synchronizes tasks between your devices, lets you focus on specific tasks and snooze tasks for later.",Productivity,,https://startupresources.io/resource/taskiness/,2022-02-05 17:08:26
248,Zillable,productivity,"Zillable is like Slack, Evernote and Trello all together in one package, along with automations and bots. Seems neat, and has a free plan.",Productivity,,https://startupresources.io/resource/zillable/,2022-02-05 17:08:30
249,Hitask,productivity,"Hitask is a project and task manager for teams. It helps to focus on team collaboration, getting tasks done and manage an entire project.’",Productivity,,https://startupresources.io/resource/hitask/,2022-02-05 17:08:34
250,Simply Noise,productivity,"When I’m working at a coffee shop or a coworking space that’s too noisy, I like to put on headphones and listen to static. Maybe that makes me sound like a crazy person, but it blocks out all outside distraction and makes me focus entirely on the task in front of me. Try it, it works.",Productivity,,https://startupresources.io/resource/simply-noise/,2022-02-05 17:08:38
251,Rescue Time,productivity,"The hardest thing about having a job on the internet is just how fascinating and distracting being on the internet all day can be. Rescue Time will monitor all your computer usage (or just the 9 to 5 use if you want) and show you in detail how you are using, or wasting, your time. A weekly report lets you know if you’re being more or less productive and focused than previous weeks. Get insight into how you’re really spending your hours and pinpoint time sucks and things you should eliminate from your routine.",Productivity,,https://startupresources.io/resource/rescue-time/,2022-02-05 17:08:42
252,Pomodoro One,productivity,"Pomodoro is Italian for tomato, and I’m not sure why breaking up your time into 25 minute blocks of work followed by 5 minutes of anything else is called the pomodoro technique, but it is, and it works. Pomodoro One is a handy app (sorry, Mac only) that just runs a timer telling you to work for 25 minutes, then giving you a 5 minute break. After a few of these, you get rewarded with a luxurious 15 minute break.",Productivity,,https://startupresources.io/resource/pomodoro-one/,2022-02-05 17:08:46
253,Mila,productivity,"Mila is a time-saver because it basically makes sure that you don’t have to copy-paste email addresses from your inbox to your spreadsheet, and then from there to MailChimp. So it automatically syncs your inbox to your marketing tools, pretty sweet. It also lets you sort all contacts into categories, so that you can mark who is a customer, who could be a customer, who is a friend, who you met at a conference, etc.",Productivity,,https://startupresources.io/resource/mila/,2022-02-05 17:08:50
254,Commit To 3,productivity,"Commit to 3 allows your team to collaborate on 3 tasks per day, the 3 tasks most important to get done for the day. I wish it were set up better for individual use, but the app really seems designed for teams. Please let me know if there is a similar solution for individuals.",Productivity,,https://startupresources.io/resource/commit-to-3/,2022-02-05 17:08:54
255,A Soft Murmur,productivity,"If static is too boring for you, A Soft Murmur allows you to blend ten sounds together, like a fire crackling, coffee shop background noise, singing bowls, waves crashing, etc, in order to produce the most soothing cacophony you need in order to focus and block out the outside world.",Productivity,,https://startupresources.io/resource/a-soft-murmur/,2022-02-05 17:08:57
256,IdeaCheck.io,research,"IdeaCheck is a reasonably priced, done-for-you approach to validating your startup idea within your target group. You draft your idea, they take care of everything else including designing the questionnaire, finding the right respondents and delivering the results within 24 hours. You get a dashboard with an assessment of your idea where you can benchmark it against hundreds of other evaluations.",Research,,https://startupresources.io/resource/ideacheck-io/,2022-02-05 17:09:05
257,Epicbeat,research,"Similar to BuzzSumo, Epicbeat lets you research the popular trends and influencers within your industry to capitalize upon these trends for your content marketing efforts. Find influencers to reach out to in order to help promote your Startup. They also have curated popular content by category if you want to browse for inspiration.",Research,,https://startupresources.io/resource/epicbeat/,2022-02-05 17:09:13
258,BuzzSumo,research,"BuzzSumo is a great resource to find influencers within your niche or industry, people who can really help give your project a boost by talking about it. Find them, butter them up, and do whatever you have to in order to get them to put your Startup in front of their audience.",Research,,https://startupresources.io/resource/buzzsumo/,2022-02-05 17:09:17
259,Drift,sales,"Drift is a conversation-driven marketing and sales automation platform. It does the job of lead qualification in a conversational way, and can book demos while you sleep.",Sales,,https://startupresources.io/resource/drift/,2022-02-05 17:09:22
260,Pipeline Deals,sales,"PipelineDeals is a sales productivity app and CRM. Track open deals along a funnel, manage your data and your sales team, and coordinate everything with this tool.",Sales,,https://startupresources.io/resource/pipeline-deals/,2022-02-05 17:09:26
261,CrankWheel,sales,"CrankWheel is a specialized screen sharing solution for instant sales teams, with built-in lead capture for Instant Demos. Its screen sharing works on all browsers and devices so you don’t need to ask your prospect to prepare – just start a screen share mid call if you need.",Sales,,https://startupresources.io/resource/crankwheel/,2022-02-05 17:09:34
262,Art of Emails,sales,"Need to start email marketing and fishing prospects with cold emails, but don’t know where to start because it all sounds horrible and intimidating? Art of Emails has lots of templates that you can use and customize to your own needs to get you started. Analyze what they suggest and learn the psychology behind it so that you can craft your own templates. And as far as I can tell, everything on this site is free. Not too shabby.",Sales,,https://startupresources.io/resource/art-of-emails/,2022-02-05 17:09:38
263,SamCart,salesfunnels,"SamCart is great if you’re selling a course, product or membership site, and has A/B testing capabilities to make your conversion as high as possible. It also doesn’t inflate your processing fees, which is great, and it allows you build in easy upselling to further increase your revenue from orders. Set it up and focus your customers down a properly funnel to lead to your real goal, which is sales.",SalesFunnels,,https://startupresources.io/resource/samcart/,2022-02-05 17:09:42
264,Petovera,salesfunnels,"Do you want help optimizing your WordPress sales funnel to generate more leads? Do you want a strategic partner who can help you optimize your website into high converting sales funnel that continuously grows your email list, generates leads, and grows your business — at a fraction of what it would cost to hire a consultant or agency? Petovera offers a very affordable monthly service to coach you, tweak, and track your web marketing funnel at all levels so you always know you’re growing.",SalesFunnels,,https://startupresources.io/resource/petovera/,2022-02-05 17:09:47
265,Optimonk,salesfunnels,"Optimonk focuses on on-site retargeting, with the goal of recovering abandoning visitors by redirecting them to another page or offering a discount. The actions that these abandoning customers see can be made specific to the page that they’re on and what they’ve done already on your site.",SalesFunnels,,https://startupresources.io/resource/optimonk/,2022-02-05 17:09:51
266,ClickFunnels,salesfunnels,"ClickFunnels provides education and webinars on sales funnels, plus a system that allows you to build out a site that is entirely focused on a proper sales funnel. If you’re pushing a course or a product, and you need a site focused on just promoting that course or product, ClickFunnels probably makes sense.",SalesFunnels,,https://startupresources.io/resource/clickfunnels/,2022-02-05 17:09:55
267,Carthook,salesfunnels,"If people start checking out on your site, but abandon the cart, you can use Carthook to put them onto an email drip series or send them a coupon, if they entered an email address at any point in the form. Reduce cart abandonment and increase revenue easily with Carthook. They also have a system to increase upsells during checkout funnels.",SalesFunnels,,https://startupresources.io/resource/carthook/,2022-02-05 17:09:59
268,NeedToMeet,schedulers,"Online meeting and appointment scheduler that simplifies the process of scheduling meetings, appointments, events, etc. especially when there are multiple attendees. Freemium, paid starts at $12/year/user.",Schedulers,,https://startupresources.io/resource/needtomeet/,2022-02-05 17:10:04
269,X.ai,schedulers,"X.ai is a game changer in the scheduling world. It’s an artificially intelligent personal assistant, going by the name Amy, and if you need to schedule a meeting time with someone, you just CC her on the email, and she will take over coordinating a time that works for all parties involved by looking at your calendar. Less annoying back and forth. The future is sort of here, as far as scheduling meetings over emails goes.",Schedulers,,https://startupresources.io/resource/x-ai/,2022-02-05 17:10:09
270,YouCanBook.me,schedulers,"YouCanBook.me integrates with your calendar so that people can know when you’re available and book a call or a meeting. No more back and forth saying ‘when are you available?’ With a smooth interface and nice reminder emails, YouCanBook.me is a great system for people to book your time.",Schedulers,,https://startupresources.io/resource/youcanbook-me/,2022-02-05 17:10:13
271,ScheduleOnce,schedulers,"ScheduleOnce is a nice scheduling solution if you want people to be able to book demos, meetings, or interviews with you. It has API integration, which allows you to send a new booking not only to your calendar, but also to Zapier so that it can go to a million other systems, to your CRM, to Trello, to a retargeting advertising campaign, whatever you need.",Schedulers,,https://startupresources.io/resource/scheduleonce/,2022-02-05 17:10:16
272,Calendly,schedulers,"I’m including Calendly because everytime I ask someone to meet with me, or everytime someone requests my time, and they send me a link to Calendly to schedule a meeting time, I’m just impressed by the ease and the clear UI of Calendly. It’s got everything you could need in a schedular, and the free version has nearly everything you could ever need.",Schedulers,,https://startupresources.io/resource/calendly/,2022-02-05 17:10:21
273,SiteGuru,seo,"SiteGuru is an automated checklist for your website. It checks your site for SEO issues, usability problems, and technical faults. Just enter your URL and within 15 seconds, they show you how you can make your website even better. Analyze just a single page, or sign up using your email to have your entire website checked. They found issues I wasn’t aware of on www.startupresources.io and provided actionable advice.",SEO,,https://startupresources.io/resource/siteguru/,2022-02-05 17:10:25
274,Unamo,seo,"Previously Positionly, now Unamo does a lot more for SEO than just tracking your rankings, such as site audits and backlink exploring. Plus they also now provide sophisticated conversion tracking and social media monitoring.",SEO,,https://startupresources.io/resource/unamo/,2022-02-05 17:10:29
275,SEcockpit,seo,"SEcockpit is an extremely advanced keyword research tool. Gone are the days when Google gave you enough information to get by, now you need to get a specialized tool for keyword research, and SEcockpit is the one to use. It’s great for exploring keywords, starting with the one you know, then learning of valuable low hanging fruit that you can go after. It also makes it easy to compare potential traffic volume to how hard it is to rank, so you know what to focus on.",SEO,,https://startupresources.io/resource/secockpit/,2022-02-05 17:10:33
276,SEMrush,seo,"Want to crush your competition in the search rankings? SEMrush lets you analyze all of your competition’s efforts, including display and paid search. Then use their sets of tools and project management to go hard in the paint to outrank your competition.",SEO,,https://startupresources.io/resource/semrush/,2022-02-05 17:10:37
277,Moz,seo,"Moz is a full featured SEO suite. What I use it for most is keeping track of my rankings and the report that it can run on my sites and their individual pages, grading each one for SEO potential. Focus on getting each page to a grade of ‘A’ for your desired search terms and you’ll see results in the search engine result pages.",SEO,,https://startupresources.io/resource/moz/,2022-02-05 17:10:42
278,Growth Geeks Gig: Monthly SEO for your site,seo,"SEO As A Service, in which they optimize 2 pages on your site per month, fixing up everything, including the alt tags that people never bother to fill out, doing the keyword research and implementing it. This is an ideal solution if you don’t want to take the time of effort to optimize your site.",SEO,,https://startupresources.io/resource/growth-geeks-gig-monthly-seo-for-your-site/,2022-02-05 17:10:46
279,Glasshat,seo,"Glasshat is a data-driven digital marketing planning tool that provides startups and small business owners with a way to effortlessly plan their online marketing campaigns by telling them which digital marketing activity to do next, and why. Glasshat will scan your site and identify what you can improve not only for SEO but also for content marketing and branding. From there it’s easy to make an action list and start improving your site.",SEO,,https://startupresources.io/resource/glasshat/,2022-02-05 17:10:50
280,Ahrefs,seo,"I could have put this in the ‘espionage’ category as well. When you’re focused on getting to the top of the first page for a certain search phrase, you know who you’re trying to outrank. With Ahrefs, you can reverse engineer what they’ve done to get to the top of the results, then either duplicate it or do what they did but better, so that you can knock them down a notch and take over.",SEO,,https://startupresources.io/resource/ahrefs/,2022-02-05 17:10:54
281,Bubble,sitebuilders,Bubble empowers users to build fully functional websites and web applications without code using its powerful drag and drop editor.,SiteBuilders,,https://startupresources.io/resource/bubble/,2022-02-05 17:10:58
282,Bookmark,sitebuilders,"Bookmark uses artificial intelligence to create your website for you. Very quick to start, lots of starting points for different types of websites, and they have a freemium model.",SiteBuilders,,https://startupresources.io/resource/bookmark/,2022-02-05 17:11:01
283,Strikingly,sitebuilders,"Strikingly’s focus is to make the easiest website editor possible, and they succeeded. If you don’t want to bother with learning to code a site yourself, or setting up a complicated content management system, but still need something flexible and full featured, Strikingly is your solution.",SiteBuilders,,https://startupresources.io/resource/strikingly/,2022-02-05 17:11:06
284,Orson,sitebuilders,"Orson makes it easier to build professional, mobile and efficient websites, by utilizing over 100 pre-designed blocks with structured content based on web marketing & web design best practices. Building a page is now merely a matter of picking a block, dropping it on the page and tailoring the content to your wishes. Orson creates a world first, with Orson bot, who is going to help you during the whole building website process: Checking pixelated images, broken links and making your website always perfect on tablets and smartphones.",SiteBuilders,,https://startupresources.io/resource/orson/,2022-02-05 17:11:10
285,Linkwoo,sitebuilders,"Free mobile website builder that can be used along side of a current existing websites using mobile redirection for any business, organization, or project that does not have thousands to spend on mobile design. Anyone can sell products, share coupons and vouchers, offer events, and share social pages like Facebook, Twitter, and Instagram. Each mobile site allows for the creator to add team members to manage the site and it’s content. And it all can be started for FREE.",SiteBuilders,,https://startupresources.io/resource/linkwoo/,2022-02-05 17:11:14
286,Designmodo,sitebuilders,"If you want to quickly and easily create a very visual site without having a ton of technical know how, Designmodo’s Slides system might be an ideal solution. Beautiful and mobile ready.",SiteBuilders,,https://startupresources.io/resource/designmodo/,2022-02-05 17:11:18
287,Carrd,sitebuilders,Super elegant single page builder (which does actually now allow you to simulate multiple pages). Gorgeous interface. Fantastic system to build a portfolio site or simple site without the need to know a single bit of code.,SiteBuilders,,https://startupresources.io/resource/carrd/,2022-02-05 17:11:22
288,WP Fix It,sitesupport,"Do you sometimes have issues with WordPress, but not constantly? Want someone on hand for when you do have the occassional issue, or something breaks, or you need something improved but it’s beyond your skill level? WP Fix It makes sense for that. It’s just $39 to fix one issue on your Word Press site. That includes removing malware, or increasing the speed (a speed increase is probably the single best thing you can do for your site/SEO health). So next time something’s wrong with your install, plugins, or themes, give these guys a holler.",SiteSupport,,https://startupresources.io/resource/wp-fix-it/,2022-02-05 17:11:26
289,TaskHusky,sitesupport,"TaskHusky.com provides on-demand access to expert web developers and designers for small businesses using the Shopify, Bigcommerce or WordPress platform on a low cost per task basis.",SiteSupport,,https://startupresources.io/resource/taskhusky/,2022-02-05 17:11:30
290,Optimocha,sitesupport,"Is your WordPress site kinda slow? Or is it extremely slow? Optimocha specializes in (or really obsesses over) making WordPress sites load as quickly as possible. They took one of my WordPress sites and cut the load time in less than half. Site speed is important for conversion and revenue, and people just won’t wait for a slow site to load, so get your site to load as fast as possible with Optimocha.",SiteSupport,,https://startupresources.io/resource/optimocha/,2022-02-05 17:11:34
291,DesignLive,sitesupport,"If you’ve got a Squarespace site and need help with it, the developers and designers will make the fixes and improvements that you request to your site, but the remarkable thing is that they do it while they are on a video call with you, so that you can see what they are doing, and then learn as they explain how they are implementing the changes.",SiteSupport,,https://startupresources.io/resource/designlive/,2022-02-05 17:11:39
292,MyTweetAlerts,socialmedia,MyTweetAlerts is like Google Alerts for Twitter. You can receive alerts and get emails when someone tweets about some topics and the tweet has more than X likes or Y retweets. You can also get emails if someone tweets about some keywords and he/she has more than X followers. So it is really useful to find tweets that can go viral.,SocialMedia,,https://startupresources.io/resource/mytweetalerts/,2022-02-05 17:11:43
293,SoundCloud Helper,socialmedia,SoundCloud Helper automates the job you would normally do on SoundCloud to gain more exposure; follow and unfollow users. Runs on your Mac.,SocialMedia,,https://startupresources.io/resource/soundcloud-helper/,2022-02-05 17:11:47
294,Snoopreport,socialmedia,"Instagram tool that tracks user actions on Instagram as likes, comments and follows and lets you research the competitors’ growth strategy, monitor customers activity to understand their interests and identify influencers on Instagram.",SocialMedia,,https://startupresources.io/resource/snoopreport/,2022-02-05 17:11:58
295,Planable,socialmedia,"It’s a visual social media planning platform that should save time when planning social media campaigns, especially in a team.",SocialMedia,,https://startupresources.io/resource/planable/,2022-02-05 17:12:02
296,Tweet Jukebox,socialmedia,"Make your social media life super simple with this Twitter content automation system. Not good enough? Then use the Tweet Jukebox library to share content with your tribe and help them to help you spread the word about your startup. Rotate from saved tweets and automate your posts. Best of all, you can start out a free plan.",SocialMedia,,https://startupresources.io/resource/tweet-jukebox/,2022-02-05 17:12:06
297,Upflow,socialmedia,"Upflow helps you to discover trending content relevant to your audience and share it on social media with your own call-to-action. With articles in almost any niche, Upflow can recommend content that has been proven to be popular so that you can share it to your Twitter or any following you have online. If you’re looking to automate your content marketing, Upflow may be exactly what you need.",SocialMedia,,https://startupresources.io/resource/upflow/,2022-02-05 17:12:10
298,Social Oomph,socialmedia,"I think I learned about this one from the Zero to Scale podcast. It’s similar to Buffer in that you can use it to queue posts to Twitter, but the main reason it got my attention is that you can upload a CSV of tweets to schedule them, which would be awesome, and it’s fine with having identical tweets in your queue, which Buffer doesn’t allow. It also helps you find new people to follow, and can automatically follow people back and whatnot. Lots of features.",SocialMedia,,https://startupresources.io/resource/social-oomph/,2022-02-05 17:12:14
299,Instagress,socialmedia,"Instagress is automation software for Instagram. Add your account, specify your activities, and set it to run. It can automatically like photos and follow people based on hashtags or locations. It’s a very affordable way to automate your Instagram growth and outreach, and there’s a free three day trial to give it a shot. (Note: This tool probably violates Instagram’s TOS and you could be blocked for using it, so try it at your own risk.)",SocialMedia,,https://startupresources.io/resource/instagress/,2022-02-05 17:12:18
300,Instagram Growth Engine,socialmedia,"In my opinion, growing an Instagram following is harder than growing Twitter, because there are less tools out there to automate things. My Instagram for Vacord Screen Printing grew significantly when I used this service. Due to Instagram’s very limited and strict API, there aren’t any super awesome growth automation tools, so you should hire a human to do it. First month is free.",SocialMedia,,https://startupresources.io/resource/instagram-growth-engine/,2022-02-05 17:12:21
301,Social Media Machine,socialmedia,"The founder of Growth Geeks, Bronson Taylor, suggested I included this one for my audience here. They curate content relevant to your audience and send it out to your Facebook, Google+ and Twitter. But beyond curating content, they also create custom content for your social media, keeping your company’s voice and writing content relevant to your business / audience.",SocialMedia,,https://startupresources.io/resource/social-media-machine/,2022-02-05 17:12:25
302,Pexels,stockphotos,Pexels has a lot of free stock photos.,StockPhotos,,https://startupresources.io/resource/pexels/,2022-02-05 17:12:30
303,Unsplash,stockphotos,"10 new stock photos every 10 days, big and gorgeous ones, that you can do whatever you want with. If you want a good example of a site that uses these, check out Pixelarity and scroll down to their templates. Unsplash is a wildly popular template site for a reason.",StockPhotos,,https://startupresources.io/resource/unsplash/,2022-02-05 17:12:34
304,stockphotos.io,stockphotos,"500 pages of searchable stock photos well categorized and ready for you to use for whatever project you’ve got going on. The only downside is that the images aren’t that large in format, but they’d be suitable for social media share and smaller images in blog posts.",StockPhotos,,https://startupresources.io/resource/stockphotos-io/,2022-02-05 17:12:38
305,Stokpic,stockphotos,"Awesome stock photos that cannot be found anywhere else, Stokpic is a great place to start if you need visuals. Photographed by Photographer Ed Gregory and a team of curated artists from around the world, these photos are both interesting and exciting. Started as a passion project, this site has grown to be a premium place for amazing free photos.",StockPhotos,,https://startupresources.io/resource/stokpic/,2022-02-05 17:12:42
306,LibreStock,stockphotos,"There are a ton of free stock image sites out there, so why not search through 40 at a time when you need something? That’s what LibreStock allows you to do. Beautifully laid out and easy to use, LibreStock will provide a ton of options for whatever images you search for.",StockPhotos,,https://startupresources.io/resource/librestock/,2022-02-05 17:12:46
